{
  "workflow_id": "choose-your-first-offer",
  "version": "0.1.0",
  "title": "Choose Your First Offer",
  "summary": "Compare an intensive, lab, and kit with one evidence-bound scorecard and choose the fastest truthful offer hypothesis to validate.",
  "kind": "skill",
  "entrypoint": {"skill_id": "threadify-choose-your-first-offer", "source": "plugins/threadify/skills/threadify-choose-your-first-offer/SKILL.md"},
  "bundle": {
    "kind": "advanced",
    "standalone": false,
    "references": [
      {"source": "schemas/offer-decision.v1.json", "target": "references/offer-decision.v1.json"}
    ]
  },
  "dependencies": {"workflows": ["find-your-niche", "refresh-your-threads-profile"], "files": ["workflows/choose-your-first-offer/README.md", "schemas/offer-decision.v1.json"]},
  "triggers": ["choose my first offer", "compare an intensive, cohort, and digital product", "what should I sell first"],
  "io": {
    "inputs": [{"name": "confirmed audience, constraints, and evidence summary", "schema_ref": "schemas/offer-decision.v1.json"}],
    "outputs": [{"name": "offer decision and Proof Loop Map", "schema_ref": "inline:offer-decision-artifacts"}]
  },
  "supported_adapters": ["generic-mcp", "codex", "claude", "cursor", "hermes", "gemini", "openclaw"],
  "required_mcp_tools": [],
  "optional_mcp_tools": ["get_connection_defaults", "list_offers", "query_brain", "greatest_hits"],
  "free_capabilities": ["three-model comparison", "fixed weighted scorecard", "Proof Loop Map", "inactive local validation page"],
  "paid_capability_stubs": ["connected owned-evidence reads depend on current Threadify scopes and entitlement"],
  "approval_gate": {
    "required": true,
    "type": "explicit-final-approval",
    "must_show": ["audience", "problem", "result", "truthful boundary", "evidence limitations", "all three scorecards"]
  },
  "fallback": {
    "mode": "constraint-led-local-hypothesis",
    "instructions": ["Use a reviewed niche report and owner-supplied constraints when connected evidence is unavailable.", "Label incomplete coverage and unknown counts instead of inventing them.", "Keep the validation page inactive and report that no market test occurred."]
  },
  "receipt": {
    "schema": "workflow-receipt.v1",
    "must_prove": ["workflow ID", "input hash", "selected model", "evidence state", "external action count", "fallback state"]
  }
}
