{
  "workflow_id": "offer-builder",
  "version": "0.1.0",
  "title": "Threadify Offer Builder",
  "summary": "An adaptive offer interview, local HTML page and optional approved CTA Studio save.",
  "kind": "skill",
  "entrypoint": { "skill_id": "threadify-offer-builder", "source": "plugins/threadify/skills/threadify-offer-builder/SKILL.md" },
  "bundle": { "kind": "advanced", "standalone": false },
  "dependencies": { "workflows": [], "files": ["workflows/offer-builder/README.md"] },
  "triggers": ["build my offer", "interview me and make an offer page"],
  "io": {
    "inputs": [{ "name": "offer interview answers", "schema_ref": "inline:offer-interview-answers" }],
    "outputs": [{ "name": "offer handoff", "schema_ref": "inline:offer-handoff" }]
  },
  "supported_adapters": [
    "generic-mcp",
    "codex",
    "claude",
    "hermes",
    "gemini",
    "openclaw",
    "cursor"
  ],
  "required_mcp_tools": [],
  "optional_mcp_tools": [
    "get_connection_defaults",
    "list_offers",
    "create_offer",
    "update_offer"
  ],
  "free_capabilities": [
    "local interview",
    "local HTML page",
    "inspectable offer handoff"
  ],
  "paid_capability_stubs": [
    "Threadify offer storage requires a connected eligible account"
  ],
  "approval_gate": {
    "required": true,
    "type": "explicit-final-approval",
    "must_show": [
      "account",
      "action",
      "target offer",
      "name",
      "benefit",
      "link",
      "type",
      "full facts replacement"
    ]
  },
  "fallback": {
    "mode": "local-offer-handoff",
    "instructions": [
      "Retain local offer.html and owner-handoff.json.",
      "Connect the client to https://www.threadify.app/api/mcp/openai using OAuth or manually enter approved fields in CTA Studio.",
      "Report unavailable authentication, scope, destination or provider readback without claiming a save."
    ]
  },
  "receipt": {
    "schema": "workflow-receipt.v1",
    "must_prove": [
      "workflow ID",
      "interview mode",
      "answered and skipped questions",
      "confirmed facts",
      "account",
      "action approval",
      "provider readback",
      "UI state",
      "fallback state"
    ]
  }
}
